"id","source","content"
1007,"wiki","thomas is a photographer whose natural landscapes of the west are also astatementabout the importance of the preservation of the wildness"
1002,"misc","contact mark at cricket@espn.com for all cricket info"
1006,"wiki","houstonis the largest city in texas and thefourth-largestin the united states, whilesan antoniois the second largest and seventh largest in the state."
1004,"wiki","thecontiguousunited statesconsists of the 48 adjoiningu.s. statespluswashington, d.c., on the continent ofnorth america"
1005,"wiki","california's economy is centered ontechnology,finance,real estate services, government, and professional, scientific and technicalbusiness services; together comprising 58% of the state government economy"
1003,"misc","contact roger at tennis@espn.com for all tennis info"
1001,"misc","contact alan by email at  sports@espn.com  for all sport info"
